{
  "argv": [
    "/usr/bin/git",
    "diff",
    "--name-only"
  ],
  "artifact_paths": [],
  "created_at": "2026-01-28T16:02:40.327588+00:00",
  "cwd": "/Users/macbook/Desktop/a2rchitech-workspace/a2rchitech/crates/kernel/tools-gateway/../../..",
  "env_allowlist": [],
  "exit_code": 0,
  "receipt_id": "subprocess-96dde737-e7e5-45d6-842d-98e0b5e7ff8d",
  "run_id": "run_subproc_allow",
  "stderr_hash": "54dc9366cf6d804bdf5ae1ffa172dab10fc68a63170232134cbe6981ee4634fb",
  "stderr_preview": "git: warning: confstr() failed with code 5: couldn't get path of DARWIN_USER_TEMP_DIR; using /tmp instead\n",
  "stdout_hash": "e65d0dca6e511e462e117a946e40dda9dd136f364138983784ff5edd48f72761",
  "stdout_preview": ".a2r/beads/graphs/graph-0001.json\n.a2r/graphs/graph-0001.json\n.github/workflows/ci-cd.yml\n.gitignore\nA2rchitech_Phase3_to_Phase7_Roadmap.md\nACTION_PLAN_CLI_ROBUSTNESS.md\nACTION_PLAN_CLI_TUI_UNIFIED.md\nACTION_PLAN_PHASE_4_5.md\nACTION_PLAN_PHASE_6_EMBODIMENT.md\nACTION_PLAN_PHASE_6_FRONTEND.md\nACTION_PLAN_PHASE_6_VOICE.md\nACTION_PLAN_PHASE_8_BRAIN.md\nACTION_PLAN_PHASE_8_FIXES.md\nACTION_PLAN_PHASE_8_MULTI_PROVIDER.md\nACTION_PLAN_PHASE_9_API.md\nACTION_PREVIEW_PLAN.md\nAGENTS.md\nBUILD_ORDER_ROADMAP.md\nCOMPLETE_ROADMAP_PHASE_4_7.md\nCargo.toml\nEXECUTION_AND_SAFETY_MODEL.md\nFEATURES.md\nINTEGRATION.md\nMINIAPP_IMPLEMENTATION_PLAN.md\nMINIAPP_INTERACTION_PLAN.md\nNAVIGATION_IMPLEMENTATION_PLAN.md\nORCHESTRATION_PLAN.md\nP0_IMPLEMENTATION_PLAN.md\nPhase_11_TUI_Completion_Report.md\nPhase_4_5_Completion_Report.md\nPhase_6_Embodiment_Completion_Report.md\nPhase_6_Frontend_Report.md\nPhase_7_Completion_Report.md\nPhase_8_CLI_Completion_Report.md\nPhase_8_Completion_Report.md\nPhase_8_Gaps_Completion_Report.md\nQUICKSTART.md\nREADME.md\nREAL_TOOLS_PLAN.md\nREGISTRY_AND_KERNEL_PLAN.md\nRELEASE_WORKFLOW.md\nSESSION_ARCH_OVERVIEW.md\nSESSION_SUMMARY.md\nSTUDIO_PRIMITIVES.md\nSTUDIO_VIEW_REDESIGN.md\nWASM_AGENTIC_OS_PLAN.md\nWORKFLOW_TRANSITION_PLAN.md\na2rchitech.jsonl\napps/api/src/routes.rs\napps/cli/Cargo.toml\napps/cli/Gizziocli:mc2.md\napps/cli/src/client.rs\napps/cli/src/commands/brain.rs\napps/cli/src/commands/daemon.rs\napps/shared/contracts.ts\napps/shell/index.html\napps/shell/package-lock.json\napps/shell/package.json\napps/shell/src/App.tsx\napps/shell/src/components/ActionDock.tsx\napps/shell/src/components/MarketplaceView.tsx\napps/shell/src/components/OpenWorkView.tsx\napps/shell/src/iconography/CapsuleIconRegistry.tsx\napps/shell/src/main.ts\napps/shell/src/runtime/ApiClient.ts\napps/shell/src/runtime/ShellState.tsx\napps/shell/src/styles.css\napps/shell/src/styles/layout.css\napps/shell/test-results/.last-run.json\napps/shell/tsconfig.json\napps/shell/vite.config.ts\napps/ui/package-lock.json\napps/ui/package.json\napps/ui/src/a2ui/components.ts\napps/ui/src/a2ui/core/renderer-new.ts\napps/ui/src/a2ui/index.ts\napps/ui/src/a2ui/renderer.test.ts\napps/ui/src/a2ui/renderer.ts\napps/ui/src/index.ts\napps/ui/src/views/CanvasRenderer.ts\napps/ui/src/views/ViewRegistry.ts\napps/ui/tsconfig.json\ncrates/capsule-runtime/Cargo.toml\ncrates/capsule-runtime/src/lib.rs\ncrates/capsule-runtime/src/lifecycle.rs\ncrates/capsule-runtime/src/main.rs\ncrates/capsule-runtime/src/schema.rs\ncrates/control/artifact-registry/Cargo.toml\ncrates/control/artifact-registry/src/lib.rs\ncrates/embodiment/Cargo.toml\ncrates/evidence_store/src/test_remove_fix.txt\ncrates/intent-graph-kernel/src/error.rs\ncrates/intent-graph-kernel/src/main.rs\ncrates/intent-graph-kernel/src/mutation.rs\ncrates/intent-graph-kernel/src/projection.rs\ncrates/intent-graph-kernel/src/query.rs\ncrates/intent-graph-kernel/src/storage.rs\ncrates/kernel/kernel-contracts/src/lib.rs\ncrates/kernel/messaging/src/storage/sqlite.rs\ncrates/kernel/policy/src/lib.rs\ncrates/kernel/tools-gateway/src/lib.rs\ncrates/ops/packaging/Cargo.toml\ncrates/ops/packaging/src/lib.rs\ncrates/orchestration/workflows/Cargo.toml\ncrates/orchestration/workflows/src/engine/loader.rs\ncrates/orchestration/workflows/src/engine/validator.rs\ncrates/orchestration/workflows/src/lib.rs\ncrates/presentation-kernel/src/canvas_protocol.rs\ncrates/presentation-kernel/src/main.rs\ncrates/rlm/Cargo.toml\ncrates/rlm/src/lib.rs\ncrates/rlm/src/modes/base.rs\ncrates/rlm/src/modes/mod.rs\ncrates/rlm/src/modes/rlm.rs\ncrates/rlm/src/modes/session.rs\ncrates/rlm/src/router.rs\ncrates/sdk/sdk-core/src/lib.rs\ncrates/sdk/sdk-functions/src/lib.rs\ncrates/security/evals/Cargo.toml\ncrates/security/evals/src/lib.rs\ncrates/skills/src/storage/mod.rs\nreference/extism\nscripts/taskgraph.py\nscripts/validate_law.py\nservices/framework/Cargo.toml\nservices/framework/src/dynamic_framework.rs\nservices/framework/src/main.rs\nservices/framework/src/templates.rs\nservices/kernel/Cargo.toml\nservices/kernel/src/agent_registry.rs\nservices/kernel/src/brain/adapters/mod.rs\nservices/kernel/src/context_manager.rs\nservices/kernel/src/embodiment/d",
  "worker_id": "git.diff"
}